Founded Date,Founded Date Precision,Organization Name,Organization Name URL,Categories,Description,Headquarters Location,Headquarters Regions,Operating Status,Number of Funding Rounds,Funding Status,Last Funding Date,Last Funding Amount,Last Funding Amount Currency,Last Funding Amount Currency (in USD),Last Funding Type,Total Funding Amount,Total Funding Amount Currency,Total Funding Amount Currency (in USD)
30-08-2014,day,Heliocor,https://www.crunchbase.com/organization/heliocor,"Apps, Artificial Intelligence, Banking, Blockchain, Compliance, Cryptocurrency, FinTech, Information Technology, Machine Learning, Software",SaaS. Building a Digital Identity Ecosystem.,"City Of London, England, United Kingdom",European Union (EU),Active,2.0,Seed,01-11-2018,1700000.0,USD,1700000.0,Pre-Seed,2700000.0,USD,2700000.0
01-04-2017,month,Oriente,https://www.crunchbase.com/organization/oriente,"Artificial Intelligence, Asset Management, Big Data, Consumer Lending, FinTech, Lending, Machine Learning, Micro Lending, Mobile, Mobile Apps",Oriente is building a new digital financial services infastructure to unlock economic opportunity for emerging Asia's underserved.,"Hong Kong, Hong Kong Island, Hong Kong",Asia-Pacific (APAC),Active,2.0,Early Stage Venture,28-11-2018,105000000.0,USD,105000000.0,Series A,105000000.0,USD,105000000.0
01-01-2015,year,Lemonade,https://www.crunchbase.com/organization/lemonade,"Artificial Intelligence, Financial Services, Insurance, InsurTech","Lemonade is a full stack insurance company powered by AI and behavioral economics, and driven by social good.","New York, New York, United States","Greater New York Area, East Coast, Northeastern US",Active,5.0,Late Stage Venture,19-12-2017,120000000.0,USD,120000000.0,Series C,180000000.0,USD,180000000.0
01-10-2016,day,Fluidly,https://www.crunchbase.com/organization/fluidly,"Accounting, Business Information Systems, Financial Services, Machine Learning","Fluidly is fundamentally rethinking the way businesses plan and manage cashflow, using data science, accounting domain expertise.","London, England, United Kingdom",European Union (EU),Active,2.0,Early Stage Venture,13-11-2018,5000000.0,GBP,6507501.0,Series A,7000000.0,GBP,9193445.0
01-01-2012,year,Onfido,https://www.crunchbase.com/organization/onfido,"Artificial Intelligence, Compliance, FinTech, Identity Management, Information Technology, Internet, Security, Software",Onfido builds trust in an online world by helping businesses digitally verify people’s identities.,"London, England, United Kingdom",European Union (EU),Active,6.0,Late Stage Venture,27-09-2017,30000000.0,USD,30000000.0,Series C,60300000.0,USD,60300000.0
01-12-2012,day,AppZen,https://www.crunchbase.com/organization/appzen,"Accounting, Artificial Intelligence, Big Data, Enterprise Software, FinTech, SaaS",AppZen offers an artificial Intelligence powered SaaS solution for automating enterprise back office processes.,"Santa Clara, California, United States","San Francisco Bay Area, Silicon Valley, West Coast",Active,6.0,Early Stage Venture,30-10-2018,35000000.0,USD,35000000.0,Series B,51000000.0,USD,51000000.0
01-01-2015,year,omni:us,https://www.crunchbase.com/organization/omnius,"Artificial Intelligence, Insurance, InsurTech, Machine Learning",omni:us delivers structured data from highly variable documents to streamline insurance back end processes.,"Berlin, Berlin, Germany",European Union (EU),Active,2.0,Early Stage Venture,30-10-2018,19700000.0,EUR,22352606.0,Series A,23900000.0,EUR,26815942.0
01-11-2016,month,Syndio Solutions,https://www.crunchbase.com/organization/syndio,"Analytics, Compliance, Human Resources, Legal, Machine Learning, Predictive Analytics, SaaS, Social Network","Syndio is a people analytics company solving today's business challenges with data science, such as closing the gender pay gap","Santa Cruz, California, United States","San Francisco Bay Area, West Coast, Western US",Active,3.0,Seed,14-11-2018,5200000.0,USD,5200000.0,Seed,7100000.0,USD,7100000.0
24-09-2014,day,Fraugster,https://www.crunchbase.com/organization/fraugster,"Artificial Intelligence, Big Data, FinTech",Fraugster is a German-Israeli anti-fraud company that uses artificial intelligence to eliminate fraud and increase customers’ profits.,"Leeds, Leeds, United Kingdom",European Union (EU),Active,2.0,Early Stage Venture,07-11-2018,14000000.0,USD,14000000.0,Series B,19000000.0,USD,19000000.0
01-01-2018,year,Figure,https://www.crunchbase.com/organization/figure-66e9,"Artificial Intelligence, Blockchain, Finance, Financial Services, FinTech",Figure is a financial technology company that provides home equity release solutions.,"San Francisco, California, United States","San Francisco Bay Area, West Coast, Western US",Active,2.0,Early Stage Venture,26-05-2018,50000000.0,USD,50000000.0,Series A,100000000.0,USD,100000000.0
01-02-2012,day,Kreditech Holding,https://www.crunchbase.com/organization/kreditech,"Artificial Intelligence, Banking, Big Data, Finance, Financial Services, FinTech, Lending, Personal Finance",Kreditech uses machine-learning technologies to provide access to better credit for the underbanked,"Hamburg, Hamburg, Germany",European Union (EU),Active,13.0,Late Stage Venture,10-05-2017,110000000.0,EUR,119539490.0,Corporate Round,497320437.0,USD,497320437.0
18-10-2009,day,Feedzai,https://www.crunchbase.com/organization/feedzai,"Analytics, Artificial Intelligence, Big Data, FinTech, Information Technology, Risk Management","Feedzai is AI, with today’s most advanced risk management platform powered by artificial intelligence to make banking and commerce safe.","San Mateo, California, United States","San Francisco Bay Area, Silicon Valley, West Coast",Active,7.0,Late Stage Venture,17-10-2017,50000000.0,USD,50000000.0,Series C,76120203.0,USD,76120203.0
01-01-2013,year,Cazana,https://www.crunchbase.com/organization/cazana,"Artificial Intelligence, Automotive, Big Data, FinTech, InsurTech, Machine Learning, Predictive Analytics","Valuation and risk data to power the next generation of vehicle ownership. Used by car manufacturers, finance companies & insurers globally.","London, England, United Kingdom",European Union (EU),Active,2.0,Seed,01-10-2017,2300000.0,USD,2300000.0,Seed,3288737.0,USD,3288737.0
01-01-2010,year,Narrative Science,https://www.crunchbase.com/organization/narrative-science,"Analytics, Artificial Intelligence, Big Data, Data Mining, FinTech",Narrative Science is the leader in Advanced Natural Language Generation for the enterprise.,"Chicago, Illinois, United States","Greater Chicago Area, Great Lakes, Midwestern US",Active,7.0,Late Stage Venture,14-04-2017,11000000.0,USD,11000000.0,Series D,43400000.0,USD,43400000.0
24-05-2015,day,AND Global Pte.Ltd,https://www.crunchbase.com/organization/and-global-and-systems,"Artificial Intelligence, Finance, FinTech, Lending",AND GLOBAL Pte.Ltd is a Singapore based True FinTech Company powered by Machine Learning and Brilliant Minds. ,"Singapore, Central Region, Singapore","Asia-Pacific (APAC), Association of Southeast Asian Nations (ASEAN), Southeast Asia",Active,6.0,Seed,01-11-2018,5300000.0,USD,5300000.0,Seed,14968000.0,USD,14968000.0
01-01-2013,year,MoneyLion,https://www.crunchbase.com/organization/moneylion,"Artificial Intelligence, Consumer Lending, Credit, Financial Services, FinTech","MoneyLion is empowering the American dream by providing everyone access to better products for borrowing, saving and investing.","New York, New York, United States","Greater New York Area, East Coast, Northeastern US",Active,4.0,Early Stage Venture,04-01-2018,42000000.0,USD,42000000.0,Series B,67499428.0,USD,67499428.0
01-01-2008,year,Ayasdi,https://www.crunchbase.com/organization/ayasdi,"Analytics, Artificial Intelligence, Big Data, Data Visualization, FinTech, Machine Learning",Ayasdi offers a machine intelligence platform that helps organizations gain transformative advantage from big data,"Menlo Park, California, United States","San Francisco Bay Area, Silicon Valley, West Coast",Active,7.0,Late Stage Venture,25-03-2015,55000000.0,USD,55000000.0,Series C,106348982.0,USD,106348982.0
17-05-2011,day,Digital Shadows,https://www.crunchbase.com/organization/digital-shadows,"Analytics, Artificial Intelligence, Cyber Security, Risk Management","Protect your organization against digital risks across the open, deep, and dark web.","San Francisco, California, United States","San Francisco Bay Area, West Coast, Western US",Active,5.0,Late Stage Venture,20-09-2017,26000000.0,USD,26000000.0,Series C,48000000.0,USD,48000000.0
01-09-2015,month,wefox Group,https://www.crunchbase.com/organization/financefox,"Artificial Intelligence, FinTech, Insurance, InsurTech, Internet of Things",wefox: Platform that connects insurances to brokers that consult their customers completely digital; ONE: Fully digital insurance company,"Berlin, Berlin, Germany",European Union (EU),Active,4.0,Early Stage Venture,10-11-2017,5000000.0,USD,5000000.0,Debt Financing,38500000.0,USD,38500000.0
01-01-2013,year,Kasisto,https://www.crunchbase.com/organization/kasisto-inc,"Artificial Intelligence, Computer, FinTech, Information Technology, Software",Kasisto is a conversational AI platform for the finance industry with the most comprehensive production deployments.,"New York, New York, United States","Greater New York Area, East Coast, Northeastern US",Active,3.0,Early Stage Venture,13-12-2017,17000000.0,USD,17000000.0,Series B,28450000.0,USD,28450000.0
01-09-2012,day,Socure Inc.,https://www.crunchbase.com/organization/socure,"FinTech, Identity Management, Machine Learning, Security, Social Media",Socure is a predictive analytics platform for digital ID verification of consumers and businesses.,"New York, New York, United States","Greater New York Area, East Coast, Northeastern US",Active,6.0,Early Stage Venture,09-08-2017,13900000.0,USD,13900000.0,Series B,31900000.0,USD,31900000.0
20-12-2013,day,DataVisor,https://www.crunchbase.com/organization/datavisor,"Analytics, Big Data, Cyber Security, Fraud Detection, Machine Learning",DataVisor uses Unsupervised Machine Learning to detect fraud & financial crime before they can inflict damage.,"Mountain View, California, United States","San Francisco Bay Area, Silicon Valley, West Coast",Active,3.0,Late Stage Venture,09-02-2018,40000000.0,USD,40000000.0,Series C,54500000.0,USD,54500000.0
01-01-2013,year,Deserve,https://www.crunchbase.com/organization/deserve,"Analytics, Big Data, Credit Cards, Financial Services, FinTech, Internet, Machine Learning, Mobile Payments",Deserve is a next gen fintech company  that is helping millennials and Gen Z’s gain access to fair credit products through m/c learning. ,"Menlo Park, California, United States","San Francisco Bay Area, Silicon Valley, West Coast",Active,7.0,Late Stage Venture,27-08-2018,17000000.0,USD,17000000.0,Series C,95400000.0,USD,95400000.0
01-01-2002,year,Dtex Systems,https://www.crunchbase.com/organization/dtex-systems,"Business Intelligence, Cyber Security, Machine Learning, Predictive Analytics, Risk Management, Security, Software",User behavior intelligence provides complete visibility into everything users do on their work devices without compromising privacy.,"San Jose, California, United States","San Francisco Bay Area, Silicon Valley, West Coast",Active,3.0,Late Stage Venture,01-09-2017,9086573.0,USD,9086573.0,Series C,39534904.0,USD,39534904.0
01-01-2013,year,Lumiata,https://www.crunchbase.com/organization/lumiata,"Analytics, Artificial Intelligence, Big Data, Health Care, Machine Learning, Medical, Predictive Analytics, Risk Management",Lumiata provides AI-powered predictive analytics for managing healthcare costs and risk impacting millions of lives.,"San Mateo, California, United States","San Francisco Bay Area, Silicon Valley, West Coast",Active,4.0,Early Stage Venture,10-07-2018,11000000.0,USD,11000000.0,Series B,31000000.0,USD,31000000.0
02-06-2014,day,Behavox,https://www.crunchbase.com/organization/behavox,"Artificial Intelligence, Data Visualization, FinTech",Holistic employee surveillance system,"London, England, United Kingdom",European Union (EU),Active,4.0,Early Stage Venture,14-11-2017,20000000.0,USD,20000000.0,Series B,21400000.0,USD,21400000.0
09-11-2015,day,Cleo,https://www.crunchbase.com/organization/cleo-ai,"Artificial Intelligence, Finance, FinTech",Cleo is an artificial intelligence startup that offers an intelligent assistant to help users in managing their finances.,"London, England, United Kingdom",European Union (EU),Active,3.0,Early Stage Venture,21-09-2018,10000000.0,USD,10000000.0,Series A,13322899.0,USD,13322899.0
01-01-2014,year,Ravelin,https://www.crunchbase.com/organization/ravelin,"Artificial Intelligence, Cyber Security, FinTech, Fraud Detection, Information Technology, Machine Learning",Ravelin is a smart fraud detection and prevention platform that helps companies stop online payment fraud.,"London, England, United Kingdom",European Union (EU),Active,4.0,Early Stage Venture,11-09-2018,8000000.0,GBP,10412978.0,Series B,12300000.0,GBP,16073392.0
01-05-2014,day,Simility,https://www.crunchbase.com/organization/simility,"Fraud Detection, Machine Learning, Real Time","Simility helps companies prevent fraud and abuse in real time with machine learning, big data analytics and data visualization capabilities.","Palo Alto, California, United States","San Francisco Bay Area, Silicon Valley, West Coast",Active,4.0,M&A,12-12-2017,17500000.0,USD,17500000.0,Series B,24700000.0,USD,24700000.0
06-03-2016,day,Quantexa,https://www.crunchbase.com/organization/quantexa,"Analytics, Artificial Intelligence, Big Data, Compliance, Financial Services, FinTech","Quantexa is a big data analytics company, driving actionable intelligence in the fight against financial crime and customer insight.","London, England, United Kingdom",European Union (EU),Active,2.0,Early Stage Venture,02-08-2018,20000000.0,USD,20000000.0,Series B,23300000.0,USD,23300000.0
29-05-2012,day,Emailage,https://www.crunchbase.com/organization/emailage,"Air Transportation, Artificial Intelligence, E-Commerce, FinTech, Fraud Detection, Machine Learning, Real Time, SaaS, Software",Emailage provides transactional risk assessment by assessing and scoring email data for organizations around the world.,"Chandler, Arizona, United States","Greater Phoenix Area, Western US",Active,2.0,Early Stage Venture,19-06-2018,10000000.0,USD,10000000.0,Series B,15674970.0,USD,15674970.0
07-02-2014,day,CloudCherry,https://www.crunchbase.com/organization/cloudcherry,"Analytics, Banking, Business Intelligence, Cloud Computing, Customer Service, Data Integration, Enterprise Software, Financial Services, Information Technology, Market Research, Mobile, Predictive Analytics, Retail Technology, SaaS, Text Analytics",The Next Generation Voice Of Customer & Experience Management SaaS platform,"Salt Lake City, Utah, United States",Western US,Active,4.0,Early Stage Venture,06-09-2018,9000000.0,USD,9000000.0,Series A,16000000.0,USD,16000000.0
25-04-2011,day,DueDil,https://www.crunchbase.com/organization/duedil,"Analytics, Artificial Intelligence, Compliance, Credit, Data Integration, Developer APIs, Information Services, Sales, Transaction Processing",DueDil is the largest source of private company information in the UK & Ireland. It helps companies find new opportunities & mitigate risk.,"London, England, United Kingdom",European Union (EU),Active,8.0,Late Stage Venture,20-08-2018,8000000.0,GBP,10243343.0,Series C,43034923.0,USD,43034923.0
01-01-2015,year,Trim,https://www.crunchbase.com/organization/trim,"Artificial Intelligence, Consumer, Financial Services, FinTech, Machine Learning",Trim automates your financial life.,"San Francisco, California, United States","San Francisco Bay Area, West Coast, Western US",Active,2.0,Seed,20-07-2016,2200000.0,USD,2200000.0,Seed,2200000.0,USD,2200000.0
01-01-2017,year,OnSiteIQ,https://www.crunchbase.com/organization/onsiteiq,"Computer Vision, Construction, Enterprise Software, Insurance, Risk Management",OnSiteIQ is a tech-enabled construction visual documentation and Risk Assessment service,"New York, New York, United States","Greater New York Area, East Coast, Northeastern US",Active,5.0,Seed,15-11-2018,2000000.0,USD,2000000.0,Seed,2000000.0,USD,2000000.0
01-03-2015,month,UnifyID,https://www.crunchbase.com/organization/unifyid,"Enterprise Software, Identity Management, Information Technology, Machine Learning",UnifyID is an identity platform that offers seamless security through implicit authentication.,"San Francisco, California, United States","San Francisco Bay Area, West Coast, Western US",Active,1.0,Early Stage Venture,01-08-2017,20000000.0,USD,20000000.0,Series A,20000000.0,USD,20000000.0
18-04-2016,day,Zego,https://www.crunchbase.com/organization/zegocover,"Artificial Intelligence, Commercial Insurance, Finance, FinTech, Insurance, InsurTech, Professional Services, Property Insurance, Small and Medium Businesses",Zego is a global insurtech business providing flexible commercial insurance for businesses & professionals,"London, England, United Kingdom",European Union (EU),Active,3.0,Early Stage Venture,18-11-2017,6000000.0,GBP,7930214.0,Series A,9738890.0,USD,9738890.0
01-01-2014,year,Cytora,https://www.crunchbase.com/organization/cytora,"Analytics, Artificial Intelligence, Big Data, Commercial Insurance, Insurance, Risk Management","Cytora is a technology company powering a new way for commercial insurers to target, select and price risk.","London, England, United Kingdom",European Union (EU),Active,4.0,Early Stage Venture,06-12-2017,5900000.0,USD,5900000.0,Series A,8819867.0,USD,8819867.0
23-04-2012,day,Moneytree,https://www.crunchbase.com/organization/moneytree,"Analytics, Artificial Intelligence, Banking, Big Data, Credit Cards, Finance, FinTech, Personal Finance","Moneytree is Japan’s #1 financial data aggregation platform, providing financial data API services (B2E) and personal finance apps (B2C)","Tokyo, Tokyo, Japan",Asia-Pacific (APAC),Active,4.0,Early Stage Venture,02-05-2017,1000000000.0,JPY,8930714.0,Series B,10530714.0,USD,10530714.0
01-01-2013,year,Knowtions Research,https://www.crunchbase.com/organization/myknowtions,"Artificial Intelligence, Enterprise Software, InsurTech, Machine Learning, Natural Language Processing","Knowtions combines machine learning and expert communities to solve multilingual data challenges in social listening, patient experience","Toronto, Ontario, Canada",Great Lakes,Active,2.0,Early Stage Venture,13-11-2018,5000000.0,USD,5000000.0,Series A,5780000.0,USD,5780000.0
14-01-2014,day,Aire,https://www.crunchbase.com/organization/aire,"Artificial Intelligence, Credit, FinTech, Machine Learning",Aire gives people a new credit score to help them qualify for essential financial products.,"London, England, United Kingdom",European Union (EU),Active,5.0,Early Stage Venture,22-07-2017,5000000.0,USD,5000000.0,Series A,12000000.0,USD,12000000.0
29-01-2015,day,Aira Tech Corp,https://www.crunchbase.com/organization/aira,"Artificial Intelligence, Assistive Technology, Augmented Reality, Computer Vision, Health Care, Internet of Things, Machine Learning, Social Impact, Wearables",Aira combines AR + AI technology with human IQ to give legally blind people the augmented ability to access the entire visual world.,"La Jolla, California, United States","Greater San Diego Area, West Coast, Western US",Active,4.0,Early Stage Venture,16-05-2017,12000000.0,USD,12000000.0,Series B,15340000.0,USD,15340000.0
01-07-2015,day,Bud,https://www.crunchbase.com/organization/bud,"Developer APIs, Finance, Financial Services, FinTech, Machine Learning",Bud is the financial network combining APIs & Data to create a new species of connected experiences ,"London, England, United Kingdom",European Union (EU),Active,1.0,Seed,24-10-2017,1500000.0,GBP,1969563.0,Seed,1500000.0,GBP,1969563.0
11-07-2013,day,Canopy,https://www.crunchbase.com/organization/canopy-cloud,"Analytics, Apps, Big Data, Data Visualization, Finance, Information Services, Information Technology, Wealth Management","Canopy is a financial data aggregation, visualization, analytics, and reporting platform.","Singapore, Central Region, Singapore","Asia-Pacific (APAC), Association of Southeast Asian Nations (ASEAN), Southeast Asia",Active,5.0,Early Stage Venture,26-09-2018,4800000.0,USD,4800000.0,Series A,14325000.0,USD,14325000.0
01-01-2016,year,Zelros,https://www.crunchbase.com/organization/zelros,"Artificial Intelligence, InsurTech, Machine Learning",AI for Augmented Insurers,"Paris, Ile-de-France, France",European Union (EU),Active,1.0,Early Stage Venture,03-12-2018,4000000.0,EUR,4542197.0,Series A,4000000.0,EUR,4542197.0
05-03-2015,day,Getsafe,https://www.crunchbase.com/organization/safe,"Artificial Intelligence, Insurance, InsurTech",Getsafe is a mobile first insurance company for the digital age.,"Heidelberg, Baden-Wurttemberg, Germany",European Union (EU),Active,2.0,Early Stage Venture,23-11-2015,12000000.0,USD,12000000.0,Series A,12700000.0,USD,12700000.0
01-01-2014,year,AimBrain,https://www.crunchbase.com/organization/aimbrain,"Artificial Intelligence, Biometrics, Biotechnology, Cyber Security, FinTech",AimBrain is a BIDaaS (Biometric Identity as-a-Service) platform with five proprietary biometric authentication modules,"London, England, United Kingdom",European Union (EU),Active,4.0,Early Stage Venture,19-06-2017,4000000.0,GBP,5092271.0,Series A,4365000.0,GBP,5636346.0
01-01-2013,year,GeoSpock Ltd.,https://www.crunchbase.com/organization/geospock-ltd-,"Artificial Intelligence, Asset Management, Database, Geospatial, Information Services, Logistics, Mobile, Real Time, SaaS, Smart Cities","GeoSpock provides intelligent, software solutions that addresses essential data challenges related to space, time, scale and speed.","Cambridge, Cambridgeshire, United Kingdom",European Union (EU),Active,4.0,Early Stage Venture,22-02-2018,6600000.0,USD,6600000.0,Series A,17460000.0,USD,17460000.0
18-07-2013,day,TruValue Labs,https://www.crunchbase.com/organization/truvalue,"FinTech, Information Technology, Language Learning, Machine Learning",TruValue Labs' products provide advanced analytics to create usable and real-time sustainability metrics for better investment decisions.,"San Francisco, California, United States","San Francisco Bay Area, West Coast, Western US",Active,2.0,Early Stage Venture,14-05-2018,13600000.0,USD,13600000.0,Series A,13600000.0,USD,13600000.0
01-03-2014,day,Premonition,https://www.crunchbase.com/organization/premonition,"Artificial Intelligence, Information Services, Insurance, InsurTech, Legal, Predictive Analytics",Premonition - The World's Largest Litigation Database,"Miami, Florida, United States","Greater Miami Area, East Coast, Southern US",Active,2.0,Seed,04-11-2015,2000000.0,USD,2000000.0,Seed,5000000.0,USD,5000000.0
01-10-2015,month,ForwardLane,https://www.crunchbase.com/organization/forwardlane,"Artificial Intelligence, Asset Management, Finance, Financial Services, Machine Learning, Natural Language Processing, PaaS, Wealth Management",ForwardLane is an AI FinTech company.,"New York, New York, United States","Greater New York Area, East Coast, Northeastern US",Active,4.0,Seed,15-03-2018,4750000.0,USD,4750000.0,Seed,6725000.0,USD,6725000.0
01-01-2015,year,Ascent Technologies Inc.,https://www.crunchbase.com/organization/ascent-technologies,"Artificial Intelligence, Compliance, Financial Services",Ascent Technologies is a RegTech Intelligence-as-a-Service company that uses Domain AI and cloud software to automate regulatory compliance.,"Chicago, Illinois, United States","Greater Chicago Area, Great Lakes, Midwestern US",Active,3.0,Early Stage Venture,01-03-2018,6000000.0,USD,6000000.0,Series A,7445000.0,USD,7445000.0
01-01-2010,year,Cosmo Tech,https://www.crunchbase.com/organization/cosmo-company,"Analytics, Asset Management, B2B, Predictive Analytics, Software",Cosmo Tech is a global technology company that helps the C-suite make optimal business decisions.,"Lyon, Rhone-Alpes, France",European Union (EU),Active,3.0,Early Stage Venture,11-09-2018,21000000.0,USD,21000000.0,Series B,29540943.0,USD,29540943.0
01-02-2016,month,Bambu,https://www.crunchbase.com/organization/bambu,"Artificial Intelligence, Financial Services, FinTech, Wealth Management",Bambu is a robo-advisor solution provider offering financial and consumer brands.,"Singapore, Central Region, Singapore","Asia-Pacific (APAC), Association of Southeast Asian Nations (ASEAN), Southeast Asia",Active,2.0,Early Stage Venture,11-07-2018,3000000.0,USD,3000000.0,Series A,3400000.0,USD,3400000.0
01-01-2016,year,CLARA analytics,https://www.crunchbase.com/organization/clara-analytics,"Artificial Intelligence, Computer, Insurance, InsurTech, Machine Learning, Predictive Analytics, SaaS",A leading predictive analytics company for workers’ compensation,"Santa Clara, California, United States","San Francisco Bay Area, Silicon Valley, West Coast",Active,2.0,Early Stage Venture,04-01-2018,11500000.0,USD,11500000.0,Series A,11500000.0,USD,11500000.0
04-08-2014,day,Accern,https://www.crunchbase.com/organization/accern,"Analytics, Artificial Intelligence, Big Data, Finance, FinTech",Accern is a data design company that helps automate research and data analysis processes within organizations.,"New York, New York, United States","Greater New York Area, East Coast, Northeastern US",Active,3.0,Seed,10-11-2017,3000000.0,USD,3000000.0,Seed,4435000.0,USD,4435000.0
