18-07-2017,day,Lokalist,https://www.crunchbase.com/organization/lokalist-aps,"Artificial Intelligence, Big Data, FinTech, Price Comparison",We are developing an AI that can determine the value of an item on your local secondhand market,"Copenhagen, Hovedstaden, Denmark","European Union (EU), Nordic Countries, Scandinavia",Active,2.0,Seed,04-10-2018,40000.0,EUR,46068.0,Pre-Seed,116068.0,USD,116068.0
26-01-2017,day,cover2protect,https://www.crunchbase.com/organization/cover2protect,"Artificial Intelligence, Elder Care, Health Care, InsurTech, Machine Learning, mHealth",AI driven predective healthcare solution which is aiming towards decreasing the cost of healthcare by early detection and intervention. ,"Singapore, Central Region, Singapore","Asia-Pacific (APAC), Association of Southeast Asian Nations (ASEAN), Southeast Asia",Active,1.0,Seed,06-12-2017,100000.0,USD,100000.0,Seed,100000.0,USD,100000.0
02-01-2016,day,Formotiv,https://www.crunchbase.com/organization/formotiv,"Artificial Intelligence, Fraud Detection, Predictive Analytics","Formotiv's platform analyzes end user behavioral patterns.  Our customers learn CX behavior and measure engagement, intent, trust and risk.","Philadelphia, Pennsylvania, United States","Greater Philadelphia Area, Great Lakes, Northeastern US",Active,1.0,Seed,29-06-2018,405000.0,USD,405000.0,Seed,405000.0,USD,405000.0
01-11-2014,day,QuiznGifts,https://www.crunchbase.com/organization/weesteer,"Advertising, Advertising Platforms, Brand Marketing, Charity, Consumer, E-Commerce, FinTech, Predictive Analytics, SaaS",SaaS - Digital Entertainment with Real Rewards,"Göteborg, Vastra Gotaland, Sweden","European Union (EU), Nordic Countries, Scandinavia",Active,1.0,Seed,15-03-2016,500000.0,SEK,60086.0,Seed,500000.0,SEK,60086.0
01-01-2017,year,Panda Technology,https://www.crunchbase.com/organization/panda-technology,"Big Data, Credit, Financial Services, FinTech, Lead Generation, Machine Learning, Personal Finance",China's leading FinTech startup Panda Technology is an AI-based credit management &lead-gen platform that serves users in China and SE Asia.,"Beijing, Beijing, China",Asia-Pacific (APAC),Active,1.0,Seed,29-06-2018,1511000.0,USD,1511000.0,Angel,1511000.0,USD,1511000.0
01-07-2014,day,UNFRAUD,https://www.crunchbase.com/organization/unfraud,"Artificial Intelligence, Fraud Detection, Transaction Processing", UNFRAUD is a software platform that prevents potential online fraud scenarios.,"Roma, Lazio, Italy",European Union (EU),Active,3.0,Seed,01-06-2017,50000.0,EUR,56064.0,Grant,188887.0,USD,188887.0
01-08-2010,day,Visible Market Inc.,https://www.crunchbase.com/organization/visible-markets,"Data Visualization, FinTech, Internet, Mobile",Visible Market Inc. is a financial data visualization platform that offers financial information products for mobile devices.,"New York, New York, United States","Greater New York Area, East Coast, Northeastern US",Active,3.0,Seed,18-12-2012,800000.0,USD,800000.0,Seed,900000.0,USD,900000.0
01-11-2015,month,MDOTM AI-Driven Investment Strategies,https://www.crunchbase.com/organization/mdotm-2,"Asset Management, Finance, Financial Services, FinTech, Machine Learning",Quantitative Investment Research Company,"London, England, United Kingdom",European Union (EU),Active,1.0,Early Stage Venture,23-11-2018,2000000.0,EUR,2267895.0,Series A,2000000.0,EUR,2267895.0
17-12-2017,day,InsureVite,https://www.crunchbase.com/organization/insurevite,"Artificial Intelligence, B2B, Blockchain, Collaboration, FinTech, Information Technology, Insurance, Mobile Apps",We make insurance great again using our proprietary SONAR Chatbot,"Singapore, Central Region, Singapore","Asia-Pacific (APAC), Association of Southeast Asian Nations (ASEAN), Southeast Asia",Active,1.0,Seed,03-05-2018,10000.0,USD,10000.0,Angel,10000.0,USD,10000.0
26-02-2013,day,RootAnt,https://www.crunchbase.com/organization/rootant,"Data Visualization, Developer APIs, Finance, Financial Services, FinTech, SaaS, Trading Platform, UX Design, Wealth Management","RootAnt is almost the only Fintech from China, who focus on improving financial experience and serving international financial institutions.","Shanghai, Shanghai, China",Asia-Pacific (APAC),Active,2.0,Seed,17-01-2018,85000.0,USD,85000.0,Angel,314976.0,USD,314976.0
28-03-2018,day,Efortles Inc,https://www.crunchbase.com/organization/efortles-inc,"Accounting, Industrial Automation, Machine Learning",Accounting Firm,"New York, New York, United States","Greater New York Area, East Coast, Northeastern US",Active,1.0,Seed,28-03-2018,30000.0,USD,30000.0,Seed,30000.0,USD,30000.0
01-06-2013,day,Inovance Financial Technologies,https://www.crunchbase.com/organization/inovance,"Artificial Intelligence, Big Data, Financial Services, FinTech, SaaS",Making analyzing financial data easy and actionable.,"New York, New York, United States","Greater New York Area, East Coast, Northeastern US",Active,2.0,Seed,23-09-2013,50000.0,USD,50000.0,Seed,65000.0,USD,65000.0
01-10-2014,day,kontoor,https://www.crunchbase.com/organization/kontoor,"Big Data, FinTech, Machine Learning, Predictive Analytics",Kontoor reads all news and while monitoring markets learns to think like a trader combining human intuition with machine intelligence.,"Helsinki, Southern Finland, Finland","European Union (EU), Nordic Countries, Scandinavia",Active,1.0,Seed,15-11-2014,500000.0,USD,500000.0,Seed,500000.0,USD,500000.0
01-06-2014,day,AIMO,https://www.crunchbase.com/organization/aimo,"Artificial Intelligence, Health Care, InsurTech",AIMO empowers everyone to take care of their health and optimise fitness.,"Kalmar, Kalmar Lan, Sweden","European Union (EU), Nordic Countries, Scandinavia",Active,1.0,Seed,26-04-2017,15000.0,EUR,16362.0,Seed,15000.0,EUR,16362.0
13-11-2012,day,Oriense,https://www.crunchbase.com/organization/oriense,"Artificial Intelligence, Assistive Technology, Augmented Reality, Computer Vision, Consumer Electronics, Embedded Systems, Linux, Navigation, Wearables",Oriense develops assisting devices for the blind and the visually impaired.,"Eindhoven, Noord-Brabant, The Netherlands",European Union (EU),Active,4.0,Seed,28-03-2016,50000.0,USD,50000.0,Grant,220000.0,USD,220000.0
01-01-2016,day,Union Realtime LLC,https://www.crunchbase.com/organization/union-realtime-llc-2,"Consulting, Data Visualization, FinTech, Self-Storage",Union Realtime is a financial services research and technology specialist.,"New York, New York, United States","Greater New York Area, East Coast, Northeastern US",Active,1.0,Seed,01-01-2016,215000.0,USD,215000.0,Seed,215000.0,USD,215000.0
13-09-2016,day,BovaMetrics,https://www.crunchbase.com/organization/bovametrics,"Artificial Intelligence, FinTech, Wealth Management",AI Portfolio Monitoring + Performance Based Rebalancing for Wealth Advisors,"Charlotte, North Carolina, United States","East Coast, Southern US",Active,1.0,Seed,12-03-2018,100000.0,USD,100000.0,Seed,100000.0,USD,100000.0
19-05-2016,day,Bled Tech,https://www.crunchbase.com/organization/bled-tech,"Artificial Intelligence, E-Commerce, Financial Services, FinTech, Mobile Payments, Nanotechnology",Bled Tech is a UK based company with international presence. ,"London, England, United Kingdom",European Union (EU),Active,1.0,Seed,19-05-2016,265000.0,USD,265000.0,Seed,265000.0,USD,265000.0
21-03-2018,day,zeroone.ai,https://www.crunchbase.com/organization/zeroone-ai-inc,"Artificial Intelligence, Finance, FinTech",We make AI-driven financial products on the decentralized ecosystem.,"Toronto, Ontario, Canada",Great Lakes,Active,1.0,Seed,21-03-2018,30000.0,CAD,23260.0,Seed,30000.0,CAD,23260.0
01-07-2013,day,LiquidLandscape,https://www.crunchbase.com/organization/progviz,"Big Data, Data Visualization, FinTech, Health Care",Liquid Landscape is a developer of applications that apply visualization to data and information.,"San Francisco, California, United States","San Francisco Bay Area, West Coast, Western US",Closed,1.0,Seed,23-03-2015,118000.0,USD,118000.0,Seed,118000.0,USD,118000.0
01-01-2015,year,IQCIO,https://www.crunchbase.com/organization/iqcio,"Artificial Intelligence, Financial Services, Risk Management", IQCIO empowers digital investment advice that adapts as market conditions change.,"New York, New York, United States","Greater New York Area, East Coast, Northeastern US",Active,1.0,Seed,27-12-2016,750000.0,USD,750000.0,Seed,750000.0,USD,750000.0
01-07-2017,day,ThinkerZero,https://www.crunchbase.com/organization/thinkerzero,"Artificial Intelligence, FinTech, Machine Learning",Machine Learning and Artificial Intelligence,"Boston, Massachusetts, United States","Greater Boston Area, East Coast, New England",Active,1.0,Seed,30-12-2017,125000.0,USD,125000.0,Seed,125000.0,USD,125000.0
13-06-2013,day,i2i Logic,https://www.crunchbase.com/organization/i2i-logic,"Analytics, Data Visualization, Financial Services, FinTech, Predictive Analytics, Sales, Training",i2i Logic customizes client engagement platforms for bankers and other professionals to use with their corporate and institutional clients.,"Hong Kong, Hong Kong Island, Hong Kong",Asia-Pacific (APAC),Active,1.0,Seed,01-07-2014,41250.0,USD,41250.0,Seed,41250.0,USD,41250.0
01-01-2012,year,FixNix Inc.,https://www.crunchbase.com/organization/fixnix-infosec-solutions,"Artificial Intelligence, Banking, Compliance, Financial Services, FinTech, Insurance, Machine Learning, Predictive Analytics, Risk Management, Security",Fixnix is a developer of compliance and analytics software for large corporations.,"Fremont, California, United States","San Francisco Bay Area, Silicon Valley, West Coast",Active,2.0,Seed,28-03-2016,500000.0,USD,500000.0,Seed,662510.0,USD,662510.0
01-08-2011,day,Kimerick Technologies,https://www.crunchbase.com/organization/kimerick-technologies,"Analytics, Big Data, Finance, Financial Exchanges, FinTech, Machine Learning",Software company developing artificial intelligence and machine learning algorithms: big data classification & predictive financial trading.,"Berkeley, California, United States","San Francisco Bay Area, West Coast, Western US",Active,2.0,Seed,26-08-2013,55420.0,USD,55420.0,Seed,130420.0,USD,130420.0
02-01-2016,day,7 Chord,https://www.crunchbase.com/organization/7-chord,"Analytics, Artificial Intelligence, Big Data, Credit, Data Mining, Data Visualization, Financial Services, Machine Learning, Predictive Analytics, Trading Platform",FinTech firm that uses Machine Learning (A.I.) to automate pricing and execution in corporate bonds. Corporate Bond Electronic Trading,"New York, New York, United States","Greater New York Area, East Coast, Northeastern US",Active,4.0,Seed,01-07-2018,517000.0,USD,517000.0,Seed,637000.0,USD,637000.0
01-09-2017,month,BlockClaim,https://www.crunchbase.com/organization/blockclaim,"Artificial Intelligence, Blockchain, Image Recognition, Insurance, InsurTech, Natural Language Processing, Software",AI Fraud Filtering & Blockchain Claims Automation for Insurance,"London, England, United Kingdom",European Union (EU),Active,1.0,Seed,02-04-2018,450000.0,GBP,632097.0,Seed,450000.0,GBP,632097.0
13-09-2013,day,Switchboard Sally,https://www.crunchbase.com/organization/switchboard-sally,"Artificial Intelligence, Cloud Security, Communities, Identity Management, Predictive Analytics, Privacy, Social Network","Switchboard Sally leverages the transformational potential of artificial intelligence, trustworthy computing and blockchain technologies.","San Francisco, California, United States","San Francisco Bay Area, West Coast, Western US",Active,1.0,Seed,01-05-2014,175000.0,USD,175000.0,Seed,175000.0,USD,175000.0
09-07-2002,day,DreamTai com Inc,https://www.crunchbase.com/organization/dreamtai-com-inc,"Artificial Intelligence, FinTech, Machine Learning","DreamTai com Inc uses artificial intelligence, machine learning and neural networks software for trading financial markets. ","Princeton, New Jersey, United States","East Coast, Northeastern US",Active,1.0,Seed,09-07-2002,5000.0,USD,5000.0,Seed,5000.0,USD,5000.0
