01-01-2014,year,Liber Finance Group,https://www.crunchbase.com/organization/liber-finance-group,"Artificial Intelligence, Consumer Lending, FinTech, Machine Learning, Marketplace",Liber Finance Group is a financial technology company that operates multiple AI-driven marketplaces across Europe for consumer finance,"Warsaw, Mazowieckie, Poland",European Union (EU),Active,2.0,Seed,01-06-2017,2000000.0,EUR,2242569.0,Seed,2000000.0,EUR,2242569.0
01-08-2014,day,"FitBliss, Inc.",https://www.crunchbase.com/organization/fitbliss,"Artificial Intelligence, Employee Benefits, Health Care, Health Insurance, Human Resources, InsurTech, Machine Learning, Productivity Tools, SaaS, Wellness",Optimize Health & Productivity for the Global Workforce,"San Jose, California, United States","San Francisco Bay Area, Silicon Valley, West Coast",Active,4.0,Seed,16-07-2018,120000.0,USD,120000.0,Convertible Note,380000.0,USD,380000.0
01-01-2013,year,OakNorth,https://www.crunchbase.com/organization/oaknorth-bank,"Artificial Intelligence, Banking, Big Data, Commercial Lending, Finance, Financial Services, FinTech, Lending, Machine Learning, Personal Finance, Small and Medium Businesses",OakNorth is Europe’s fastest-growing fintech by assets and valuation,"Manchester, Manchester, United Kingdom",European Union (EU),Active,6.0,Early Stage Venture,06-09-2018,100000000.0,USD,100000000.0,Series B,601034144.0,USD,601034144.0
01-01-2017,year,Cove,https://www.crunchbase.com/organization/cove-5,"Artificial Intelligence, Financial Services, FinTech, Insurance, InsurTech",Insurance. Simple.,"Auckland, Auckland, New Zealand","Asia-Pacific (APAC), Australasia",Active,2.0,Seed,01-08-2018,2000000.0,NZD,1358737.0,Seed,2000000.0,NZD,1358737.0
29-06-2018,day,FairFrame,https://www.crunchbase.com/organization/fairframe,"Artificial Intelligence, Enterprise Applications, FinTech, Human Computer Interaction, Human Resources, Machine Learning, Psychology",AI and nudge science for workplace diversity.,"New York, New York, United States","Greater New York Area, East Coast, Northeastern US",Active,2.0,Seed,10-09-2018,120000.0,USD,120000.0,Pre-Seed,195000.0,USD,195000.0
01-01-2017,year,moneytor,https://www.crunchbase.com/organization/moneytor,"Compliance, Debt Collections, Financial Services, FinTech, Machine Learning",Moneytor is making debt collection more efficient.,"Mumbai, Maharashtra, India",Asia-Pacific (APAC),Active,1.0,Seed,11-01-2018,300000.0,USD,300000.0,Seed,300000.0,USD,300000.0
01-10-2016,month,TypingDNA,https://www.crunchbase.com/organization/typingdna,"Artificial Intelligence, Biometrics, Computer, Cyber Security, FinTech","TypingDNA provides typing biometrics authentication as a service, enabling companies recognize people by the way they type.","New York, New York, United States","Greater New York Area, East Coast, Northeastern US",Active,2.0,Seed,26-01-2018,100000.0,USD,100000.0,Seed,100000.0,USD,100000.0
01-01-2015,year,Cybertonica Ltd.,https://www.crunchbase.com/organization/cybertonica,"Artificial Intelligence, Cyber Security, Financial Services, FinTech, Fraud Detection","Cybertonica provides a cloud risk intelligence hub to reduce basket drop-off and increase conversion for banks, PSPs and e-merchants.","London, England, United Kingdom",European Union (EU),Active,3.0,Seed,11-07-2018,100000.0,EUR,116759.0,Grant,433018.0,USD,433018.0
16-06-2015,day,Avocado Systems,https://www.crunchbase.com/organization/avocado-systems,"Compliance, Cyber Security, Data Visualization, Enterprise Applications",Security and Compliance - Any Application | Any Platform | Any Cloud,"San Jose, California, United States","San Francisco Bay Area, Silicon Valley, West Coast",Active,1.0,Seed,01-01-2017,1000000.0,USD,1000000.0,Angel,1000000.0,USD,1000000.0
01-01-2017,year,Mile Auto,https://www.crunchbase.com/organization/mile-auto,"Computer Vision, Insurance, InsurTech",Pay-per-mile Insurance,"Atlanta, Georgia, United States","Greater Atlanta Area, East Coast, Southern US",Active,1.0,Seed,27-10-2016,1000000.0,USD,1000000.0,Seed,1000000.0,USD,1000000.0
16-07-2018,day,Halos Insurance,https://www.crunchbase.com/organization/halos-insurance,"Artificial Intelligence, Blockchain, Consumer, Impact Investing, Insurance, InsurTech",A fully digital consumer insurance platform designed to make insurance useful for every single consumer.,"Washington, District of Columbia, United States","Washington DC Metro Area, Southern US",Active,1.0,Seed,24-07-2018,120000.0,USD,120000.0,Angel,120000.0,USD,120000.0
01-12-2016,month,Black Swan Technology,https://www.crunchbase.com/organization/black-swan-technology,"Analytics, Artificial Intelligence, Big Data, Cloud Computing, Cloud Infrastructure, Finance, FinTech, IaaS, PaaS, Predictive Analytics, Risk Management, SaaS",Structure and underwrite cloud outage insurance (COPA: Cloud Outage Payout Agreements). ,"Seattle, Washington, United States","Greater Seattle Area, West Coast, Western US",Active,2.0,Early Stage Venture,24-04-2017,3000000.0,USD,3000000.0,Series A,3250000.0,USD,3250000.0
07-05-2013,day,Chaser,https://www.crunchbase.com/organization/chaser,"Accounting, Artificial Intelligence, Finance","Striving to build Earth's best products to help businesses get their invoices paid on time, automatically","London, England, United Kingdom",European Union (EU),Active,1.0,Seed,01-04-2015,500000.0,GBP,741549.0,Seed,500000.0,GBP,741549.0
01-01-2017,year,Digital Fingerprints,https://www.crunchbase.com/organization/digital-fingerprints-is-a-continuous-authentication-solution-based-on-behavioural-biometrics,"Artificial Intelligence, Big Data, Biometrics, Cyber Security, Fraud Detection, Machine Learning, Risk Management",Digital Fingerprints is a continuous authentication solution based on behavioural biometrics compliant with PSD2 and GDPR,"Katowice, Slaskie, Poland",European Union (EU),Active,1.0,Seed,01-03-2017,2000000.0,USD,2000000.0,Seed,2000000.0,USD,2000000.0
03-02-2017,day,Bruno,https://www.crunchbase.com/organization/bruno,"Artificial Intelligence, Banking, Financial Services, FinTech",We are building a new way to interact with money. ,"Paris, Ile-de-France, France",European Union (EU),Active,1.0,Seed,05-02-2018,1000000.0,EUR,1236627.0,Seed,1000000.0,EUR,1236627.0
22-07-2015,day,MK Decision,https://www.crunchbase.com/organization/mk-decision,"Artificial Intelligence, Banking, Credit, Credit Bureau, Credit Cards, Financial Services, Machine Learning, Risk Management, SaaS, Web Apps",MK Decision's lending platform helps financial institutions make lending simple.,"San Diego, California, United States","Greater San Diego Area, West Coast, Western US",Active,2.0,Seed,03-10-2018,938000.0,USD,938000.0,Pre-Seed,1079000.0,USD,1079000.0
01-03-2017,day,GlobalWonks,https://www.crunchbase.com/organization/globalwonks,"B2B, Big Data, Enterprise, Information Services, Knowledge Management, Machine Learning, Professional Services, Risk Management, SaaS",GlobalWonks is a technology-enabled marketplace connecting decision makers with global business and policy experts within minutes,"Washington, District of Columbia, United States","Washington DC Metro Area, Southern US",Active,2.0,Seed,02-04-2018,350000.0,USD,350000.0,Seed,500000.0,USD,500000.0
01-01-2010,year,Quovo,https://www.crunchbase.com/organization/quovo,"Analytics, Artificial Intelligence, Banking, Developer APIs, Financial Services, FinTech, Machine Learning, Wealth Management",Quovo is a provider of account aggregation and data analytics technology for finance.,"New York, New York, United States","Greater New York Area, East Coast, Northeastern US",Active,4.0,Early Stage Venture,03-05-2018,4800000.0,USD,4800000.0,Series B,20975731.0,USD,20975731.0
01-04-2016,day,DealStart,https://www.crunchbase.com/organization/dealstart,"Big Data, Commercial Real Estate, Finance, FinTech, Machine Learning, Marketplace","Online platform that helps commercial real estate professionals quickly analyze, professionally model & more easily raise money for deals","New York, New York, United States","Greater New York Area, East Coast, Northeastern US",Active,1.0,Seed,01-06-2014,500000.0,USD,500000.0,Seed,500000.0,USD,500000.0
01-05-2014,month,Whistler Technologies,https://www.crunchbase.com/organization/whistler-technologies,"Data Visualization, Financial Services, FinTech, Machine Learning, Software",Enterprise Communications Monitoring &  Intelligence,"Boulder, Colorado, United States","Greater Denver Area, Western US",Active,5.0,Seed,27-01-2017,100000.0,USD,100000.0,Convertible Note,1355000.0,USD,1355000.0
03-12-2010,day,twingz,https://www.crunchbase.com/organization/twingz,"Artificial Intelligence, B2B, Energy, Energy Efficiency, InsurTech, Internet of Things, Machine Learning, Predictive Analytics",twingz delivers predictive analytics based on anomaly detection out of energy meterdata feeds & provides damage prevention services on top.,"Vienna, Wien, Austria",European Union (EU),Active,4.0,Seed,30-05-2017,100000.0,EUR,111721.0,Seed,500000.0,EUR,599175.0
01-01-2017,year,Ayomi,https://www.crunchbase.com/organization/ipoome,"Artificial Intelligence, FinTech, Software",Ayomi is the first Artificial Intelligence to automatically fund any business. ,"Paris, Ile-de-France, France",European Union (EU),Active,1.0,Seed,29-03-2018,1000000.0,EUR,1230242.0,Seed,1000000.0,EUR,1230242.0
02-05-2016,day,DUNFORCE,https://www.crunchbase.com/organization/dunforce,"Artificial Intelligence, B2B, FinTech, Payments",The smart collection agent that simplifies and accelerates the payment of your receivables.,"Barcelona, Catalonia, Spain",European Union (EU),Active,1.0,Seed,30-05-2016,100000.0,EUR,111396.0,Seed,100000.0,EUR,111396.0
01-04-2017,day,Digital Claim,https://www.crunchbase.com/organization/dcm-digital-claim-management-gmbh,"InsurTech, Legal, Machine Learning",Insuretech - automating claim recovery for insurances,"Vienna, Wien, Austria",European Union (EU),Active,2.0,Seed,01-06-2018,500000.0,USD,500000.0,Seed,650000.0,USD,650000.0
12-06-2012,day,Owlin,https://www.crunchbase.com/organization/owlin,"Analytics, Artificial Intelligence, Big Data, FinTech, Machine Learning, Natural Language Processing",Turn News into Actionable Intelligence,"Amsterdam, Noord-Holland, The Netherlands",European Union (EU),Active,1.0,Seed,11-12-2012,250000.0,USD,250000.0,Seed,250000.0,USD,250000.0
01-01-2014,year,QARA Soft,https://www.crunchbase.com/organization/qara,"Artificial Intelligence, Financial Services, FinTech",Fintech start-up that provides online investment advisory and asset management services using deep-learning technology.,"Seoul, Seoul-t'ukpyolsi, South Korea",Asia-Pacific (APAC),Active,1.0,Seed,19-02-2018,1000000.0,USD,1000000.0,Seed,1000000.0,USD,1000000.0
01-01-2015,year,CRiskCo,https://www.crunchbase.com/organization/criskco,"Accounting, Credit, Financial Services, Fraud Detection, Machine Learning",CRiskCo provide fraud detection and credit management platform for vendors and FI's using Artificial Intelligence and behavior analyses,"Palo Alto, California, United States","San Francisco Bay Area, Silicon Valley, West Coast",Active,2.0,Seed,06-12-2016,100000.0,AUD,74674.0,Grant,399674.0,USD,399674.0
01-05-2016,day,"iChain, Inc.",https://www.crunchbase.com/organization/ichain-inc,"Artificial Intelligence, Blockchain, Insurance, InsurTech, Internet of Things",iChain is Japanese leading InsurTech startup that innovates the insurance industry based on Blockchain Technology (Distributed Ledger Tech).,"Tokyo, Tokyo, Japan",Asia-Pacific (APAC),Active,2.0,Seed,18-03-2018,460000.0,USD,460000.0,Seed,960000.0,USD,960000.0
15-09-2016,day,The Beans,https://www.crunchbase.com/organization/the-beans,"FinTech, Machine Learning, Personal Finance",Wealth management at scale for the real middle class.,"San Francisco, California, United States","San Francisco Bay Area, West Coast, Western US",Active,1.0,Seed,15-08-2017,100000.0,USD,100000.0,Seed,100000.0,USD,100000.0
01-01-2015,year,Preseries,https://www.crunchbase.com/organization/preseries-tech,"Angel Investment, Artificial Intelligence, FinTech, Machine Learning, Predictive Analytics, Software, Venture Capital",PreSeries takes advantage of Machine Learning to transform startup investing into a successful data-driven practice,"Valencia, Comunidad Valenciana, Spain",European Union (EU),Active,1.0,Seed,01-06-2017,1000000.0,EUR,1121284.0,Seed,1000000.0,EUR,1121284.0
01-02-2016,day,Hyper Anna,https://www.crunchbase.com/organization/hyper-anna,"Analytics, Artificial Intelligence, Banking, FinTech, Software",Hyper Anna is an Artificial Intelligence powered data analyst - Siri for analytics.,"Sydney, New South Wales, Australia","Asia-Pacific (APAC), Australasia",Active,2.0,Early Stage Venture,21-08-2017,16000000.0,AUD,12697354.0,Series A,17250000.0,AUD,13647653.0
05-11-2015,day,Property Passbook,https://www.crunchbase.com/organization/property-passbook,"Asset Management, Big Data, Machine Learning, Property Management, Real Estate, Real Estate Investment, Wealth Management",Outperform the Global Property Market With Smart Data.,"Shanghai, Shanghai, China",Asia-Pacific (APAC),Active,2.0,Seed,30-05-2018,625000.0,USD,625000.0,Seed,625000.0,USD,625000.0
01-10-2012,day,InfoTrie,https://www.crunchbase.com/organization/infotrie-financial-solutions,"Analytics, Big Data, Data Mining, Data Visualization, Developer APIs, Finance, Financial Services, FinTech, SaaS",InfoTrie offers cutting edge technology to analyze the humongous flow of information produced by the financial industry.,"Singapore, Central Region, Singapore","Asia-Pacific (APAC), Association of Southeast Asian Nations (ASEAN), Southeast Asia",Active,1.0,Seed,31-03-2014,500000.0,SGD,397551.0,Seed,500000.0,SGD,397551.0
01-03-2015,day,VeriSmart,https://www.crunchbase.com/organization/verismart,"Artificial Intelligence, Blockchain, FinTech, Information Technology","Identity blockchain and AI based startup, Working on building. Global Trust engine for businesses making KYC process autonomous.","California City, California, United States","West Coast, Western US",Active,6.0,Seed,01-06-2018,40000.0,USD,40000.0,Seed,705000.0,USD,705000.0
16-02-2016,day,Active.ai,https://www.crunchbase.com/organization/active-ai,"Artificial Intelligence, Financial Services, FinTech, Information Technology",Active.ai is a service platform that connects consumers with their banks via micro conversation.,"Singapore, Central Region, Singapore","Asia-Pacific (APAC), Association of Southeast Asian Nations (ASEAN), Southeast Asia",Active,3.0,Early Stage Venture,13-11-2017,8250000.0,USD,8250000.0,Series A,11750000.0,USD,11750000.0
26-01-2011,day,Mujo Mechanics,https://www.crunchbase.com/organization/mujo-mechanics,"Analytics, Artificial Intelligence, Assistive Technology, Hardware, Health Care, Health Diagnostics, Internet of Things, Medical, Medical Device, Online Portals, Personalization, Predictive Analytics, Real Time, Rehabilitation, Robotics, Sensor, Software, Sports",Mujo Mechanics provides smart devices and intelligent cloud platform for a data-driven approach to musculoskeletal health.,"London, England, United Kingdom",European Union (EU),Active,3.0,Seed,24-03-2017,1500000.0,GBP,1870725.0,Angel,1700000.0,GBP,2117580.0
01-04-2016,day,Houzen,https://www.crunchbase.com/organization/houzen,"Artificial Intelligence, Asset Management, Internet, Machine Learning, Property Management, Real Estate",Matching property with its ideal tenants in 3-5 days,"London, England, United Kingdom",European Union (EU),Active,1.0,Seed,01-11-2017,500000.0,GBP,662827.0,Angel,500000.0,GBP,662827.0
01-01-2010,year,DigitalMR,https://www.crunchbase.com/organization/digitalmr,"Analytics, Big Data, FinTech, Machine Learning, Predictive Analytics, SaaS",DigitalMR is a tech company that uses A.I. for customer insights,"London, England, United Kingdom",European Union (EU),Active,2.0,Seed,01-09-2013,448000.0,USD,448000.0,Convertible Note,1468000.0,USD,1468000.0
02-02-2018,day,Poleecy,https://www.crunchbase.com/organization/poleecy,"Artificial Intelligence, Auto Insurance, Blockchain, Commercial Insurance, Health Insurance, Insurance, InsurTech, Machine Learning, Property Insurance","Instant Insurance, Insurtech, Blockchain","Roma, Lazio, Italy",European Union (EU),Active,1.0,Seed,20-04-2018,300000.0,EUR,369378.0,Seed,300000.0,EUR,369378.0
11-09-2017,day,WeGroup,https://www.crunchbase.com/organization/wegroup,"Artificial Intelligence, Financial Services, Insurance, InsurTech, Natural Language Processing, Peer to Peer",WeGroup is a digital peer-to-peer (P2P) InsurTech company.,"Bruges, West-Vlaanderen, Belgium",European Union (EU),Active,1.0,Seed,11-09-2017,150000.0,EUR,179370.0,Seed,150000.0,EUR,179370.0
01-01-2017,year,Kellify,https://www.crunchbase.com/organization/kellify,"Artificial Intelligence, Financial Services, FinTech, Machine Learning",Kellify is a venture-backed AI  fintech startup company.,"Genova, Liguria, Italy",European Union (EU),Active,1.0,Seed,16-07-2018,1730000.0,USD,1730000.0,Seed,1730000.0,USD,1730000.0
01-08-2015,day,AgentRisk - Superhuman Wealth Management,https://www.crunchbase.com/organization/agentrisk,"Artificial Intelligence, Financial Services, FinTech, Wealth Management","Automated portfolio management & option strategies, all managed by A.I.","Los Angeles, California, United States","Greater Los Angeles Area, West Coast, Western US",Active,1.0,Seed,11-12-2016,300000.0,USD,300000.0,Angel,300000.0,USD,300000.0
30-12-2016,day,Satoshi Systems Limited,https://www.crunchbase.com/organization/satoshi-systems,"Blockchain, Computer, FinTech, Machine Learning, Software, Trading Platform","Satoshi Systems provides state of the art software solutions for the trading space, currently focusing on the commodity.","London, England, United Kingdom",European Union (EU),Active,1.0,Seed,18-03-2017,1250000.0,GBP,1548860.0,Seed,1250000.0,GBP,1548860.0
01-03-2018,day,WeTuring,https://www.crunchbase.com/organization/weturing,"Artificial Intelligence, Blockchain, Cryptocurrency, FinTech","WeTuring is set to revolutionize the financial services world by creating a decentralized, autonomous platform using AI and Blockchain","Santa Clara, California, United States","San Francisco Bay Area, Silicon Valley, West Coast",Active,1.0,Seed,01-02-2018,2000000.0,USD,2000000.0,Seed,2000000.0,USD,2000000.0
03-04-2014,day,Link Big,https://www.crunchbase.com/organization/link-big,"B2B, Cloud Computing, Cloud Data Services, FinTech, Information Services, InsurTech, Machine Learning, Retail Technology, Social Media Marketing, Travel",Link Big is a smart link that finally transform general mobile web links to personal user experience links.,"Birmingham, Birmingham, United Kingdom",European Union (EU),Active,4.0,Seed,01-12-2017,125000.0,GBP,168420.0,Seed,379716.0,USD,379716.0
16-10-2013,day,DwellAware,https://www.crunchbase.com/organization/dwellaware,"Analytics, Big Data, Business Intelligence, FinTech, Information Services, Internet, Predictive Analytics, Real Estate",We quantify risks & costs for businesses and their customers in the housing sector,"San Francisco, California, United States","San Francisco Bay Area, West Coast, Western US",Closed,2.0,Seed,23-03-2014,1581000.0,USD,1581000.0,Seed,2181000.0,USD,2181000.0
05-09-2013,day,Financial Network Analytics,https://www.crunchbase.com/organization/financial-network-analytics,"Analytics, Artificial Intelligence, Data Visualization, Enterprise Software, Fraud Detection, Payments, Risk Management, Simulation",The Standard for Graph Analytics in Finance,"London, England, United Kingdom",European Union (EU),Active,2.0,Seed,15-01-2016,25000.0,EUR,27284.0,Seed,559284.0,USD,559284.0
01-06-2016,day,Emerada,https://www.crunchbase.com/organization/emerada,"Artificial Intelligence, FinTech, Lending",Emerada is a bank account aggregation & cashflow analytics platform to SMEs and banks for enhancing lending activity in Japan.,"Tokyo, Tokyo, Japan",Asia-Pacific (APAC),Active,1.0,Seed,07-04-2017,2500000.0,USD,2500000.0,Seed,2500000.0,USD,2500000.0
01-09-2017,day,BUNCH,https://www.crunchbase.com/organization/bunch-4710,"Artificial Intelligence, FinTech, Internet, Outsourcing, Task Management",A modern outsourcing house for high-growth tech companies,"Hong Kong, Hong Kong Island, Hong Kong",Asia-Pacific (APAC),Active,1.0,Seed,01-06-2017,200000.0,USD,200000.0,Seed,200000.0,USD,200000.0
23-09-2012,day,Unified Computer Intelligence Corporation,https://www.crunchbase.com/organization/the-ubi,"Human Computer Interaction, Internet of Things, Lending, Natural Language Processing, Smart Home",Unified Computer Intelligence Corporation is a tools and services for rapidly prototyping and adding voice interaction to hardware devices.,"Toronto, Ontario, Canada",Great Lakes,Active,3.0,Seed,02-03-2014,1100000.0,CAD,993405.0,Angel,1319795.0,USD,1319795.0
01-01-2015,year,VendorMach,https://www.crunchbase.com/organization/vendormach,"Analytics, Artificial Intelligence, B2B, Data Mining, Internet, Risk Management, Supply Chain Management","Big data analytics platform for ecommerce supplier planning and accounts payable (AP) reconciliations, reducing fraud, error and costs.","New York, New York, United States","Greater New York Area, East Coast, Northeastern US",Active,4.0,Seed,30-06-2017,800000.0,USD,800000.0,Seed,820000.0,USD,820000.0
18-10-2016,day,LUXLOCK,https://www.crunchbase.com/organization/luxlock,"Artificial Intelligence, Big Data, E-Commerce, Enterprise Software, Identity Management, Retail Technology, Unified Communications",Unified Experience Platform,"New York, New York, United States","Greater New York Area, East Coast, Northeastern US",Active,2.0,Seed,01-11-2016,61500.0,USD,61500.0,Seed,61500.0,USD,61500.0
01-01-2016,year,Sway Finance,https://www.crunchbase.com/organization/sway-finance,"Accounting, Artificial Intelligence, B2B, Finance, FinTech, Machine Learning, SaaS, Software",Sway Finance is bringing artificial intelligence to the accounting industry.,"San Francisco, California, United States","San Francisco Bay Area, West Coast, Western US",Active,1.0,Seed,22-08-2016,120000.0,USD,120000.0,Seed,120000.0,USD,120000.0
01-06-2014,month,Ampliphae Ltd,https://www.crunchbase.com/organization/ampliphae-ltd,"Artificial Intelligence, Compliance, Machine Learning, SaaS, Telecommunications",Ampliphae uses analytics and machine learning to understand and automate wide-area networks.,"Belfast, Belfast, United Kingdom",European Union (EU),Active,1.0,Seed,02-03-2016,1400000.0,GBP,1970975.0,Seed,1400000.0,GBP,1970975.0
01-02-2016,month,Waymark Tech,https://www.crunchbase.com/organization/waymark-tech-ltd,"Artificial Intelligence, Compliance, FinTech, Legal, Machine Learning, SaaS",Waymark Tech offers a platform that breaks regulations down by turning the complex into prescriptive actions.,"London, England, United Kingdom",European Union (EU),Active,2.0,Seed,01-09-2017,30000.0,EUR,35585.0,Seed,30000.0,EUR,35585.0
01-06-2018,day,PayScanner,https://www.crunchbase.com/organization/payscanner,"Artificial Intelligence, Billing, Financial Services, FinTech, Machine Learning, Payments",Helping legacy payment ecosystems to adopt emerging payment ecosystems.,"London, England, United Kingdom",European Union (EU),Active,1.0,Seed,03-06-2018,250000.0,GBP,333837.0,Seed,250000.0,GBP,333837.0
01-01-2016,day,TALK Accounting,https://www.crunchbase.com/organization/talk-accounting,"Accounting, Android, Artificial Intelligence, Finance, FinTech, iOS, Small and Medium Businesses",TALK Accounting codes and verifies your transactions to automate bookkeeping via voice-to-data system.,"Tucson, Arizona, United States",Western US,Active,2.0,Seed,07-02-2017,500000.0,USD,500000.0,Convertible Note,900000.0,USD,900000.0
23-06-2013,day,Irisbond,https://www.crunchbase.com/organization/irisbond,"Artificial Intelligence, Assistive Technology, Consumer Electronics, Software",Irisbond creates a new way for humans to communicate based on precision eye tracking technology.,"San Sebastian, Pais Vasco, Spain",European Union (EU),Active,3.0,Early Stage Venture,08-01-2018,1230000.0,EUR,1472318.0,Series B,1580000.0,EUR,1877412.0
01-02-2016,month,Yedup Limited,https://www.crunchbase.com/organization/yedup-limited,"Artificial Intelligence, Big Data, FinTech, Hedge Funds, Machine Learning, Natural Language Processing, Real Time","Yedup develops real-time, continually adaptive AI technology for high value, ultra-low latency capital markets applications.","Belfast, Belfast, United Kingdom",European Union (EU),Active,1.0,Seed,13-04-2017,500000.0,GBP,625212.0,Seed,500000.0,GBP,625212.0
19-04-2017,day,Techwisely Ltd,https://www.crunchbase.com/organization/techwisely-ltd,"Advertising, Artificial Intelligence, Big Data, FinTech, Loyalty Programs, Machine Learning, Mobile Payments, Retail Technology, Speech Recognition","Available on mobile and smartwatch platform, we offer world's first hands-free counterless checkout solution eliminating the need of queuing","London, England, United Kingdom",European Union (EU),Active,2.0,Seed,26-05-2018,50000.0,GBP,66540.0,Seed,100000.0,GBP,131290.0
21-05-2014,day,Novofina,https://www.crunchbase.com/organization/novofina,"Artificial Intelligence, Finance, FinTech, Wealth Management",Algorithm-based Wealth Management FinTech/WealthTech — New Finance,"Mosta, NA - Malta, Malta",European Union (EU),Active,2.0,Seed,31-01-2016,1000000.0,EUR,1083045.0,Seed,1600000.0,EUR,1903160.0
06-12-2016,day,"GTop Group, Inc.",https://www.crunchbase.com/organization/gtop-group-corp,"Artificial Intelligence, Asset Management, Homeland Security, Law Enforcement, Market Research, National Security, Predictive Analytics, Public Safety, Risk Management, Security",AI - Fusion Video and Data Predictive Analytic Threat Detection Technology ,"New York, New York, United States","Greater New York Area, East Coast, Northeastern US",Active,2.0,Seed,08-06-2018,500000.0,USD,500000.0,Seed,501000.0,USD,501000.0
